title,authors,summary,published,updated,link,pdf_url,categories
Minimising the expectation value of the procurement cost in electricity   markets based on the prediction error of energy consumption,"Naoya Yamaguchi, Maiya Hori, Yoshinari Ideguchi","In this paper, we formulate a method for minimising the expectation value of the procurement cost of electricity in two popular spot markets: {\it day-ahead} and {\it intra-day}, under the assumption that expectation value of unit prices and the distributions of prediction errors for the electricity demand traded in two markets are known. The expectation value of the total electricity cost is minimised over two parameters that change the amounts of electricity. Two parameters depend only on the expected unit prices of electricity and the distributions of prediction errors for the electricity demand traded in two markets. That is, even if we do not know the predictions for the electricity demand, we can determine the values of two parameters that minimise the expectation value of the procurement cost of electricity in two popular spot markets. We demonstrate numerically that the estimate of two parameters often results in a small variance of the total electricity cost, and illustrate the usefulness of the proposed procurement method through the analysis of actual data.",2018-02-22T14:29:05Z,2018-08-01T11:13:19Z,http://arxiv.org/abs/1803.04532v2,http://arxiv.org/pdf/1803.04532v2,"q-fin.EC, q-fin.GN"
Long-term memory in electricity prices: Czech market evidence,"Ladislav Kristoufek, Petra Lunackova","We analyze long-term memory properties of hourly prices of electricity in the Czech Republic between 2009 and 2012. As the dynamics of the electricity prices is dominated by cycles -- mainly intraday and daily -- we opt for the detrended fluctuation analysis, which is well suited for such specific series. We find that the electricity prices are non-stationary but strongly mean-reverting which distinguishes them from other financial assets which are usually characterized as unit root series. Such description is attributed to specific features of electricity prices, mainly to non-storability. Additionally, we argue that the rapid mean-reversion is due to the principles of electricity spot prices. These properties are shown to be stable across all studied years.",2013-09-03T04:02:28Z,2013-09-03T04:02:28Z,http://arxiv.org/abs/1309.0582v1,http://arxiv.org/pdf/1309.0582v1,q-fin.ST
RFID-BASED Prepaid Power Meter,"Rozita Teymourzadeh, Mahmud Iwan, Ahmad J. A. Abueida","An Electric power meter is an important component in electric energy service. In the past, many consumers have complained about reading inaccurate of the electric meter. This research presents the development of an electrical power meter equipped with RFID reader. The RFID reader reads a valid RFID card and activates the power meter so that it can supply electricity. When the credit is about low or before the electricity is auto cut off, an SMS message will be sent to the users handphone to alert.",2018-06-10T19:04:30Z,2018-06-10T19:04:30Z,http://arxiv.org/abs/1807.10385v1,http://arxiv.org/pdf/1807.10385v1,eess.SP
Comparison of two models of electric neuro-stimulation and consequences   for the design of retinal prostheses,Erich W. Schmid,"Two simple mathematical models of electric neuro-stimulation are derived and discussed. It is found that the common injected-charge model is less realistic than a model, in which a latency period, which follows after a short electric pulse, plays a role as important as the electric pulse. A stimulation signal is proposed that takes advantage of these findings and calls for experimental testing.",2007-11-13T09:32:33Z,2007-11-13T09:32:33Z,http://arxiv.org/abs/0711.1938v1,http://arxiv.org/pdf/0711.1938v1,q-bio.NC
"Cellular velocity, electrical persistence and sensing in developed and   vegetative cells during electrotaxis","Isabella Guido, Douglas Diehl, Nora Aleida Olszok, Eberhard Bodenschatz","Cells have the ability to detect electric fields and respond to them with directed migratory movement. Investigations identified genes and proteins that play important roles in defining the migration efficiency. Nevertheless, the sensing and transduction mechanisms underlying directed cell migration are still under discussion. We use Dictyostelium discoideum cells as model system for studying eukaryotic cell migration in DC electric fields. We have defined the temporal electric persistence to characterize the memory that cells have in a varying electric field. In addition to imposing a directional bias, we observed that the electric field influences the cellular kinematics by accelerating the movement of cells along their paths. Moreover, the study of vegetative and briefly starved cells provided insight into the electrical sensing of cells. We found evidence that conditioned medium of starved cells was able to trigger the electrical sensing of vegetative cells that would otherwise not orient themselves in the electric field. This observation may be explained by the presence of the conditioned medium factor (CMF), a protein secreted by the cells, when they begin to starve. The results of this study give new insights into understanding the mechanism that triggers the electrical sensing and transduces the external stimulus into directed cell migration. Finally, the observed increased mobility of cells over time in an electric field could offer a novel perspective towards wound healing assays.",2020-04-16T10:29:48Z,2020-04-16T10:29:48Z,http://arxiv.org/abs/2004.07575v1,http://arxiv.org/pdf/2004.07575v1,q-bio.CB
Nash equilibrium for coupling of CO2 allowances and electricity markets,"Mireille Bossy, Nadia Maizi, Odile Pourtallier","In this note, we present an existence result of a Nash equilibrium between electricity producers selling their production on an electricity market and buying CO2 emission allowances on an auction carbon market. The producers' strategies integrate the coupling of the two markets via the cost functions of the electricity production. We set out a clear Nash equilibrium that can be used to compute equilibrium prices on both markets as well as the related electricity produced and CO2 emissions covered.",2013-11-06T21:50:23Z,2013-11-06T21:50:23Z,http://arxiv.org/abs/1311.1535v1,http://arxiv.org/pdf/1311.1535v1,q-fin.TR
Valuation of electricity storage contracts using the COS method,"Boris C. Boonstra, Cornelis W. Oosterlee","Storage of electricity has become increasingly important, due to the gradual replacement of fossil fuels by more variable and uncertain renewable energy sources. In this paper, we provide details on how to mathematically formalize a corresponding electricity storage contract, taking into account the physical limitations of a storage facility and the operational constraints of the electricity grid. We give details of a valuation technique to price these contracts, where the electricity prices follow a structural model based on a stochastic polynomial process. In particular, we show that the Fourier-based COS method can be used to price the contracts accurately and efficiently.",2021-01-08T08:53:45Z,2021-01-08T08:53:45Z,http://arxiv.org/abs/2101.02917v1,http://arxiv.org/pdf/2101.02917v1,q-fin.MF
Day-ahead electricity price prediction applying hybrid models of   LSTM-based deep learning methods and feature selection algorithms under   consideration of market coupling,"Wei Li, Denis Mike Becker","The availability of accurate day-ahead electricity price forecasts is pivotal for electricity market participants. In the context of trade liberalisation and market harmonisation in the European markets, accurate price forecasting becomes difficult for electricity market participants to obtain because electricity forecasting requires the consideration of features from ever-growing coupling markets. This study provides a method of exploring the influence of market coupling on electricity price prediction. We apply state-of-the-art long short-term memory (LSTM) deep neural networks combined with feature selection algorithms for electricity price prediction under the consideration of market coupling. LSTM models have a good performance in handling nonlinear and complex problems and processing time series data. In our empirical study of the Nordic market, the proposed models obtain considerably accurate results. The results show that feature selection is essential to achieving accurate prediction, and features from integrated markets have an impact on prediction. The feature importance analysis implies that the German market has a salient role in the price generation of Nord Pool.",2021-01-13T18:22:28Z,2021-07-18T10:59:46Z,http://arxiv.org/abs/2101.05249v2,http://arxiv.org/pdf/2101.05249v2,q-fin.CP
Pricing electricity derivatives within a Markov regime-switching model,Joanna Janczura,"In this paper analytic formulas for electricity derivatives are calculated. To this end, we assume that electricity spot prices follow a 3-regime Markov regime-switching model with independent spikes and drops and periodic transition matrix. Since the classical derivatives pricing methodology cannot be used in case of non-storable commodities, we employ the concept of the risk premium. The obtained theoretical results are then used for the European Energy Exchange (EEX) market data. The 3-regime model is calibrated to the spot electricity prices. Next, the risk premium is derived and used to calculate prices of European options written on spot, as well as, forward prices.",2012-03-24T19:41:11Z,2012-03-24T19:41:11Z,http://arxiv.org/abs/1203.5442v1,http://arxiv.org/pdf/1203.5442v1,q-fin.PR
A simulink circuit model for measurement of consumption of electric   energy using frequency method,"Emmanouil Markoulakis, Emmanuel Antonidakis, George S. Stavrakakis",The following analysis and presentation summarizes the implementation in Matlab / Simulink environment of a prototype model digital energy circuit for measurement of the consumption of electric energy of an electrification network in the installations of customer of electric energy that can be applied as part of any consumption smart meter.,2018-11-17T11:09:17Z,2018-11-17T11:09:17Z,http://arxiv.org/abs/1811.07144v1,http://arxiv.org/pdf/1811.07144v1,eess.SP
Unitary recordings in freely-moving pulse weakly electric fish suggest   spike timing encoding of electrosensory signals,"Alejo Rodríguez-Cattáneo, Ana Carolina Pereira, Pedro Aguilera, Angel Caputi",Unitary recordings in freely-moving pulse weakly electric fish suggest spike timing encoding of electrosensory signals,2020-01-27T17:35:59Z,2020-01-27T17:35:59Z,http://arxiv.org/abs/2001.09928v1,http://arxiv.org/pdf/2001.09928v1,q-bio.NC
Deep Reinforcement Learning in Electricity Generation Investment for the   Minimization of Long-Term Carbon Emissions and Electricity Costs,"Alexander J. M. Kell, Pablo Salas, Jean-Francois Mercure, Matthew Forshaw, A. Stephen McGough","A change from a high-carbon emitting electricity power system to one based on renewables would aid in the mitigation of climate change. Decarbonization of the electricity grid would allow for low-carbon heating, cooling and transport. Investments in renewable energy must be made over a long time horizon to maximise return of investment of these long life power generators. Over these long time horizons, there exist multiple uncertainties, for example in future electricity demand and costs to consumers and investors.   To mitigate for imperfect information of the future, we use the deep deterministic policy gradient (DDPG) deep reinforcement learning approach to optimize for a low-cost, low-carbon electricity supply using a modified version of the FTT:Power model. In this work, we model the UK and Ireland electricity markets. The DDPG algorithm is able to learn the optimum electricity mix through experience and achieves this between the years of 2017 and 2050. We find that a change from fossil fuels and nuclear power to renewables, based upon wind, solar and wave would provide a cheap and low-carbon alternative to fossil fuels.",2020-11-02T15:20:49Z,2020-11-02T15:20:49Z,http://arxiv.org/abs/2011.02342v1,http://arxiv.org/pdf/2011.02342v1,eess.SP
Climate change impacts on large-scale electricity system design   decisions for the 21st Century,"Smail Kozarcanin, Hailiang Liu, Gorm Bruun Andresen","Efforts to reduce climate change, but also falling prices and significant technology developments currently drive an increased weather-dependent electricity production from renewable electricity sources. In light of the changing climate, it is highly relevant to investigate the extent of weather changes that directly impacts the best system design decisions for these weather-dependent technologies. Here, we use three IPCC representative CO2 concentrations pathways for the period 2006--2100 with six high-resolution climate experiments for the European domain. Climate elements are used to calculate bias adjusted 3-hourly time series of wind and solar generation, and temperature corrected demand time series for 30 European countries using state-of-the-art methodology. Weather-driven electricity system analysis methodology is then applied to compare four key metrics of highly renewable electricity systems. We find that climate change does not have a discernible impact on the key metrics of the combined electricity system dynamics, and conclude that the effect on important system design parameters can likely be ignored.",2018-05-02T15:32:36Z,2018-05-02T15:32:36Z,http://arxiv.org/abs/1805.01364v1,http://arxiv.org/pdf/1805.01364v1,eess.SP
Voltage Profile Improvement of Distribution Grid by Using a New Control   Approach on Injected Reactive Power of Plug-in Electric Vehicle Parking Lots   to Grid,"Mohammad Mehdi Rezvani, Reza Khoud","Establishing electrical parking lots will become more important by increasing the use of electric vehicles (EVs). These parking lots not only can be seen as high electrical power consumption loads which can cause the voltage drop at feeders but also they can be used as electrical power plants that can help the main power grid during the load peak hour or any congestion. Therefore, finding an optimum place for the building of these lots, in which the deviation of the voltage at the feeder, power loss in the grid, and cost be minimized, is essential. In this paper, a new method of vehicle-to-grid reactive power support (V2GQ) has been used to add the model of plug-in electric vehicle (PEV) as one part of the objective function to find the optimum place of parking lots. The non-sorting genetic algorithm II (NSGA2) is used here as an optimization algorithm to find the optimum voltage profile based on the location of parking lots. For validation of the purposed method, a 33-bus standard distribution network has been studied.",2019-01-29T20:44:02Z,2019-01-29T20:44:02Z,http://arxiv.org/abs/1901.10533v1,http://arxiv.org/pdf/1901.10533v1,eess.SP
Metabolic basis of brain-like electrical signalling in bacterial   communities,"Rosa Martinez-Corral, Jintao Liu, Arthur Prindle, Gurol M. Suel, Jordi Garcia-Ojalvo","Information processing in the mammalian brain relies on a careful regulation of the membrane potential dynamics of its constituent neurons, which propagates across the neuronal tissue via electrical signalling. We recently reported the existence of electrical signalling in a much simpler organism, the bacterium Bacillus subtilis. In dense bacterial communities known as biofilms, nutrient-deprived B. subtilis cells in the interior of the colony use electrical communication to transmit stress signals to the periphery, which interfere with the growth of peripheral cells and reduce nutrient consumption, thereby relieving stress from the interior. Here we explicitly address the interplay between metabolism and electrophysiology in bacterial biofilms, by introducing a spatially-extended mathematical model that combines the metabolic and electrical components of the phenomenon in a discretised reaction-diffusion scheme. The model is experimentally validated by environmental and genetic perturbations, and confirms that metabolic stress is transmitted through the bacterial population via a potassium wave. Interestingly, this behaviour is reminiscent of cortical spreading depression in the brain, characterised by a wave of electrical activity mediated by potassium diffusion that has been linked to various neurological disorders, calling for future studies on the evolutionary link between the two phenomena.",2019-02-17T23:47:34Z,2019-02-17T23:47:34Z,http://arxiv.org/abs/1902.06352v1,http://arxiv.org/pdf/1902.06352v1,"q-bio.NC, q-bio.CB"
Effects of electrical and optogenetic deep brain stimulation on   synchronized oscillatory activity in Parkinsonian basal ganglia,"Shivakeshavan Ratnadurai-Giridharan, Chung Cheung, Leonid Rubchinsky",Conventional deep brain stimulation (DBS) of basal ganglia uses high-frequency regular electrical pulses to treat Parkinsonian motor symptoms and has a series of limitations. Relatively new and not yet clinically tested optogenetic stimulation is an effective experimental stimulation technique to affect pathological network dynamics. We compared the effects of electrical and optogenetic stimulation of the basal ganglia on the pathological parkinsonian rhythmic neural activity. We studied the network response to electrical stimulation and excitatory and inhibitory optogenetic stimulations. Different stimulations exhibit different interactions with pathological activity in the network. We studied these interactions for different network and stimulation parameter values. Optogenetic stimulation was found to be more efficient than electrical stimulation in suppressing pathological rhythmicity. Our findings indicate that optogenetic control of neural synchrony may be more efficacious than electrical control because of the different ways of how stimulations interact with network dynamics.,2017-06-03T16:45:21Z,2017-06-03T16:45:21Z,http://arxiv.org/abs/1706.00976v1,http://arxiv.org/pdf/1706.00976v1,q-bio.NC
Tuning the Transdermal Transport by Application of External Continuous   Electric Field: A Molecular Dynamics Coarse-Grained Study,"Neila Machado, Clarissa Callegaro, Marcelo Augusto Christoffolete, Herculano Martinho","Since a long time the application of small electric potentials on biological membranes (iontophoresis) proved enabling control and improvement of transdermal delivery of substances across this barrier. In spite of a large experimental data, the detailed molecular mechanism of iontophoresis is absent. In the present work the interaction among the external continuous electric field with the outermost layer of the skin (\textit{stratum corneum}) was studied by coarse-grained molecular dynamics. Our results pointed out the occurrence of water-rich vesicles formation depending on the field strength. The corresponding phase diagram indicated that the large set of phenomena (vesicle formation, reversibility, phase transition, disruption) could be completely controlled by tuning external continuous electric fields. Interestingly, electric field shielding effects are in the origin of observed effects and followed a general Arrhenius-like time dependence. Direct current (DC) electric field usage would also have booster diffusion effects due to vesicles creation and reincorporation which would have direct beneficial absorption effects on water-soluble topical agents (vitamins) or dermal jet-injection of drugs by fine needles.",2019-05-06T17:56:32Z,2019-05-06T17:56:32Z,http://arxiv.org/abs/1905.02183v1,http://arxiv.org/pdf/1905.02183v1,"q-bio.TO, q-bio.SC"
A portfolio management of a small RES utility with a Structural Vector   Autoregressive model of German electricity markets,Katarzyna Maciejowska,"The changes in electricity markets expose RES producers and electricity traders to various risks, among which the price and the volume risk play a very important role. In this research, a portfolio building strategies are presented, which allow to dynamically choose a proportion of electricity traded in different electricity markets (day-ahead and intraday) and hence to optimize the behavior of an utility. Two types of approaches are considered: simple, assuming that the proportions are fixed, and data driven, which allows for thier fluctuation. In order to explore the market information, Structural Vector Autoregressive (SVAR) model is applied, which allows to estimate the relationship between variables of interest and to simulate their future distribution. The presented methods are evaluated with data coming from German electricity market. The results indicate that data driven trading strategies allow to increase the utility revenue and at the same time reduce the trading risk, measured by the predictability of the next day income and the revenue Value at Risk. It turns out that the approach based on Sharp Ratio provides the most robust results.",2022-04-28T10:24:03Z,2022-04-28T10:24:03Z,http://arxiv.org/abs/2205.00975v1,http://arxiv.org/pdf/2205.00975v1,q-fin.ST
Predicting the Impact of Electric Field Stimulation in a Detailed   Computational Model of Cortical Tissue,"Frances Hutchings, Christopher Thornton, Chencheng Zhang, Yujiang Wang, Marcus Kaiser","Neurostimulation using weak electric fields has generated excitement in recent years due to its potential as a medical intervention. However, study of this stimulation modality has been hampered by inconsistent results and large variability within and between studies. In order to begin addressing this variability we need to properly characterise the impact of the current on the underlying neuron populations. To develop and test a computational model capable of capturing the impact of electric field stimulation on networks of neurons. We construct a cortical tissue model with distinct layers and explicit neuron morphologies. We then apply a model of electrical stimulation and carry out multiple test case simulations. The cortical slice model is compared to experimental literature and shown to capture the main features of the electrophysiological response to stimulation. Namely, the model showed 1) a similar level of depolarisation in individual pyramidal neurons, 2) acceleration of intrinsic oscillations, and 3) retention of the spatial profile of oscillations in different layers. We then apply alternative electric fields to demonstrate how the model can capture differences in neuronal responses to the electric field. We demonstrate that the tissue response is dependent on layer depth, the angle of the apical dendrite relative to the field, and stimulation strength. We present publicly available computational modelling software that predicts the neuron network population response to electric field stimulation.",2020-01-28T15:37:03Z,2020-01-28T15:37:03Z,http://arxiv.org/abs/2001.10414v1,http://arxiv.org/pdf/2001.10414v1,q-bio.NC
Electricity price modeling and asset valuation: a multi-fuel structural   approach,"Rene Carmona, Michael Coulon, Daniel Schwarz","We introduce a new and highly tractable structural model for spot and derivative prices in electricity markets. Using a stochastic model of the bid stack, we translate the demand for power and the prices of generating fuels into electricity spot prices. The stack structure allows for a range of generator efficiencies per fuel type and for the possibility of future changes in the merit order of the fuels. The derived spot price process captures important stylized facts of historical electricity prices, including both spikes and the complex dependence upon its underlying supply and demand drivers. Furthermore, under mild and commonly used assumptions on the distributions of the input factors, we obtain closed-form formulae for electricity forward contracts and for spark and dark spread options. As merit order dynamics and fuel forward prices are embedded into the model, we capture a much richer and more realistic dependence structure than can be achieved by classical reduced-form models. We illustrate these advantages by comparing with Margrabe's formula and a simple cointegration model, and highlight important implications for the valuation of power plants.",2012-05-10T15:58:24Z,2012-05-10T15:58:24Z,http://arxiv.org/abs/1205.2299v1,http://arxiv.org/pdf/1205.2299v1,q-fin.PR
