title,authors,summary,published,updated,link,pdf_url,categories
A New Time Series Similarity Measure and Its Smart Grid Applications,"Rui Yuan, S. Ali Pourmousavi, Wen L. Soong, Andrew J. Black, Jon A. R. Liisberg, Julian Lemos-Vinasco","Many smart grid applications involve data mining, clustering, classification, identification, and anomaly detection, among others. These applications primarily depend on the measurement of similarity, which is the distance between different time series or subsequences of a time series. The commonly used time series distance measures, namely Euclidean Distance (ED) and Dynamic Time Warping (DTW), do not quantify the flexible nature of electricity usage data in terms of temporal dynamics. As a result, there is a need for a new distance measure that can quantify both the amplitude and temporal changes of electricity time series for smart grid applications, e.g., demand response and load profiling. This paper introduces a novel distance measure to compare electricity usage patterns. The method consists of two phases that quantify the effort required to reshape one time series into another, considering both amplitude and temporal changes. The proposed method is evaluated against ED and DTW using real-world data in three smart grid applications. Overall, the proposed measure outperforms ED and DTW in accurately identifying the best load scheduling strategy, anomalous days with irregular electricity usage, and determining electricity users' behind-the-meter (BTM) equipment.",2023-10-19T01:02:47Z,2023-10-19T01:02:47Z,http://arxiv.org/abs/2310.12399v1,http://arxiv.org/pdf/2310.12399v1,"eess.SP, eess.AS"
"Mode-locked laser timing jitter limitation in optically enabled,   spectrally sliced ADCs","Andrea Zazzi, Juliana Müller, Sergiy Gudyriev, Pablo Marin-Palomo, Dengyang Fang, J. Christoph Scheytt, Christian Koos, Jeremy Witzens","Novel analog-to-digital converter (ADC) architectures are motivated by the demand for rising sampling rates and effective number of bits (ENOB). The main limitation on ENOB in purely electrical ADCs lies in the relatively high jitter of oscillators, in the order of a few tens of fs for state-of-the-art components. When compared to the extremely low jitter obtained with best-in-class Ti:sapphire mode-locked lasers (MLL), in the attosecond range, it is apparent that a mixed electrical-optical architecture could significantly improve the converters' ENOB. We model and analyze the ENOB limitations arising from optical sources in optically enabled, spectrally sliced ADCs, after discussing the system architecture and implementation details. The phase noise of the optical carrier, serving for electro-optic signal transduction, is shown not to propagate to the reconstructed digitized signal and therefore not to represent a fundamental limit. The optical phase noise of the MLL used to generate reference tones for individual slices also does not fundamentally impact the converted signal, so long as it remains correlated among all the comb lines. On the other hand, the timing jitter of the MLL, as also reflected in its RF linewidth, is fundamentally limiting the ADC performance, since it is directly mapped as jitter to the converted signal. The hybrid nature of a photonically enabled, spectrally sliced ADC implies the utilization of a number of reduced bandwidth electrical ADCs to convert parallel slices, resulting in the propagation of jitter from the electrical oscillator supplying their clock. Due to the reduced sampling rate of the electrical ADCs, as compared to the overall system, the overall noise performance of the presented architecture is substantially improved with respect to a fully electrical ADC.",2020-04-13T09:24:00Z,2020-04-13T09:24:00Z,http://arxiv.org/abs/2004.05836v1,http://arxiv.org/pdf/2004.05836v1,eess.SP
Observations of magnetic field induced contraction of fission yeast   cells using optical projection microscopy,"Xi Yang, Andrew Beckwith","The charges in live cells interact with or produce electric fields, which results in enormous dielectric responses, flexoelectricity, and related phenomena. Here we report on a contraction of schizosacchraoymces pombe (fission yeast) cells induced by magnetic fields, as observed using a phase sensitive projection image technique. Unlike electric fields, magnetic fields only act on moving charges. The observed behavior is quite remarkable, and may result from a contractile Lorentz force acting on diamagnetic screening currents. This would indicate extremely high intracellular charge mobilities. Besides, we observed a large electro - optical response from fission yeast cells.",2004-09-02T21:34:20Z,2004-09-02T21:34:20Z,http://arxiv.org/abs/q-bio/0409007v1,http://arxiv.org/pdf/q-bio/0409007v1,q-bio.SC
A survey of electricity spot and futures price models for risk   management applications,"Thomas Deschatre, Olivier Féron, Pierre Gruet","This review presents the set of electricity price models proposed in the literature since the opening of power markets. We focus on price models applied to financial pricing and risk management. We classify these models according to their ability to represent the random behavior of prices and some of their characteristics. In particular, this classification helps users to choose among the most suitable models for their risk management problems.",2021-03-31T09:17:28Z,2021-07-29T14:29:36Z,http://arxiv.org/abs/2103.16918v2,http://arxiv.org/pdf/2103.16918v2,"q-fin.MF, q-fin.RM"
Recuperation of Regenerative Braking Energy in Electric Rail Transit   Systems,"Mahdiyeh Khodaparastan, Ahmed A. Mohamed, Werner Brandauer","Electric rail transit systems are large consumers of energy. In trains with regenerative braking capability, a fraction of the energy used to power a train is regenerated during braking. This regenerated energy, if not properly captured, is typically dumped in the form of heat to avoid overvoltage. Finding a way to recuperate regenerative braking energy can result in economic as well as technical merits. In this comprehensive paper, the various methods and technologies that were proposed for regenerative energy recuperation have been analyzed, investigated and compared. These technologies include: train timetable optimization, energy storage systems (onboard and wayside), and reversible substations.",2018-08-17T17:39:36Z,2018-08-17T17:39:36Z,http://arxiv.org/abs/1808.05938v1,http://arxiv.org/pdf/1808.05938v1,eess.SP
Target Tracking with Electrical Impedance Tomography,"Timo Huuhtanen, Antti Lankinen, Alexander Jung","Electrical impedance tomography (EIT) has been successfully applied to several important application domains such as medicine, geophysics and industrial imaging. EIT offers a high temporal resolution, which allows to track the location of a moving target on a conductive surface accurately. Existing EIT methods are geared towards high image quality instead of smooth target trajectories, which makes them suboptimal for target tracking. We combine EIT methods with hidden Markov models for tracking moving targets on a conductive surface. Numerical experiments indicate that the proposed method outperforms existing EIT methods in target tracking accuracy.",2019-11-12T13:53:27Z,2019-11-12T13:53:27Z,http://arxiv.org/abs/1911.04851v1,http://arxiv.org/pdf/1911.04851v1,eess.SP
Phase Retrieval for Rydberg Quantum Arrays,"Peter Vouras, Kumar Vijay Mishra, Alexandra Artusio-Glimpse","Rydberg-aided atomic electrometry using alkali-metal atoms is gaining increased research interest for detecting external electric fields. However, the inability of Rydberg probes to detect phase is a serious impediment to their realistic deployment. In this paper, we derive a novel phase retrieval algorithm for use in a phased array or synthetic aperture applications where only measurements of electric field intensity are possible at each spatial sample. These array configurations exist if a Rydberg atom probe is used in place of an antenna. We employ three-stage alternating projections to solve the resulting optimization problem. Our numerical experiments demonstrate the effectiveness of the proposed algorithm in terms of beamformed array output.",2023-02-05T15:10:13Z,2023-02-05T15:10:13Z,http://arxiv.org/abs/2302.02400v1,http://arxiv.org/pdf/2302.02400v1,eess.SP
Distribution Network Fault Prediction Utilising Protection Relay   Disturbance Recordings And Machine Learning,"Ebrahim Balouji, Karl Bäckström, Viktor Olsson, Petri Hovila, Henry Niveri, Anna Kulmala, Ari Salo","As society becomes increasingly reliant on electricity, the reliability requirements for electricity supply continue to rise. In response, transmission/distribution system operators (T/DSOs) must improve their networks and operational practices to reduce the number of interruptions and enhance their fault localization, isolation, and supply restoration processes to minimize fault duration. This paper proposes a machine learning based fault prediction method that aims to predict incipient faults, allowing T/DSOs to take action before the fault occurs and prevent customer outages.",2023-06-22T07:55:20Z,2023-06-22T07:55:20Z,http://arxiv.org/abs/2306.12724v1,http://arxiv.org/pdf/2306.12724v1,eess.SP
Modeling the Heart as a Communication System,"Hiroshi Ashikaga, José Aguilar-Rodríguez, Shai Gorsky, Elizabeth Lusczek, Flávia Maria Darcie Marquitti, Brian Thompson, Degang Wu, Joshua Garland","Electrical communication between cardiomyocytes can be perturbed during arrhythmia, but these perturbations are not captured by conventional electrocardiographic metrics. We developed a theoretical framework to quantify electrical communication using information theory metrics in 2-dimensional cell lattice models of cardiac excitation propagation. The time series generated by each cell was coarse-grained to 1 when excited or 0 when resting. The Shannon entropy for each cell was calculated from the time series during four clinically important heart rhythms: normal heartbeat, anatomical reentry, spiral reentry, and multiple reentry. We also used mutual information to perform spatial profiling of communication during these cardiac arrhythmias. We found that information sharing between cells was spatially heterogeneous. In addition, cardiac arrhythmia significantly impacted information sharing within the heart. Entropy localized the path of the drifting core of spiral reentry, which could be an optimal target of therapeutic ablation. We conclude that information theory metrics can quantitatively assess electrical communication among cardiomyocytes. The traditional concept of the heart as a functional syncytium sharing electrical information cannot predict altered entropy and information sharing during complex arrhythmia. Information theory metrics may find clinical application in the identification of rhythm-specific treatments which are currently unmet by traditional electrocardiographic techniques.",2014-10-08T15:36:11Z,2014-10-31T19:55:57Z,http://arxiv.org/abs/1410.2169v2,http://arxiv.org/pdf/1410.2169v2,"q-bio.QM, q-bio.TO"
Improving Short-Term Electricity Price Forecasting Using Day-Ahead LMP   with ARIMA Models,"Zhongyang Zhao, Caisheng Wang, Matthew Nokleby, Carol Miller","Short-term electricity price forecasting has become important for demand side management and power generation scheduling. Especially as the electricity market becomes more competitive, a more accurate price prediction than the day-ahead locational marginal price (DALMP) published by the independent system operator (ISO) will benefit participants in the market by increasing profit or improving load demand scheduling. Hence, the main idea of this paper is to use autoregressive integrated moving average (ARIMA) models to obtain a better LMP prediction than the DALMP by utilizing the published DALMP, historical real-time LMP (RTLMP) and other useful information. First, a set of seasonal ARIMA (SARIMA) models utilizing the DALMP and historical RTLMP are developed and compared with autoregressive moving average (ARMA) models that use the differences between DALMP and RTLMP on their forecasting capability. A generalized autoregressive conditional heteroskedasticity (GARCH) model is implemented to further improve the forecasting by accounting for the price volatility. The models are trained and evaluated using real market data in the Midcontinent Independent System Operator (MISO) region. The evaluation results indicate that the ARMAX-GARCH model, where an exogenous time series indicates weekend days, improves the short-term electricity price prediction accuracy and outperforms the other proposed ARIMA models",2018-01-04T20:24:22Z,2018-01-04T20:24:22Z,http://arxiv.org/abs/1801.02485v1,http://arxiv.org/pdf/1801.02485v1,eess.SP
Performance Degradation Assessment for Electrical Machines Based on SOM   and Hybrid DHMM,"Chong Bian, Shunkun Yang, Tingting Huang, Qingyang Xu, Jie Liu, Enrico Zio","Aimed at the timely detection of the degradation of electrical machines and the organization of active maintenance, numerous studies on performance degradation assessment have been conducted. However, previous research still suffers from two deficiencies: 1) determining the relevant relationship among diverse machine degradation states and assessing the specific degree of deterioration and 2) determining the evolutionary relationships among degradation and failure modes and assessing the failure modes corresponding to different degradation scenarios. To address these two deficiencies, a novel performance degradation assessment method is proposed. First, the self-organizing feature map (SOM) network is used to mine the latent degradation states of electrical machines. Second, the latent states are quantified according to established statistical health indexes, and by analyzing the distribution of extracted health indexes corresponding to different degradation states, the relevant transition relationships of the valid degradation states and the final evolving fault types are determined. Third, a hybrid discrete HMM is developed to fully describe the transition process among different states and assess the degradation scenario of a machine in an online manner. The results of a real application of an electric point machine show that the proposed method can identify valid degradation states and obtain a superior assessment accuracy.",2018-09-07T08:13:30Z,2018-09-07T08:13:30Z,http://arxiv.org/abs/1809.02342v1,http://arxiv.org/pdf/1809.02342v1,eess.SP
Game Theory Approach on Modeling of Residential Electricity Market by   Considering the Uncertainty due to the Battery Electric Vehicles (BEVs),"Ramin Faraji Fijani, Behrouz Azimian, Ehsan Ghotbi, Xingwu Wang","The rapid progression of sophisticated advance metering infrastructure (AMI), allows us to have a better understanding and data from demand-response (DR) solutions. There are vast amounts of research on the internet of things and its application on the smart grids has been examined to find the most optimized bill for the user; however, we propose a novel approach of house loads, combined with owning a battery electric vehicle (BEV) equipped with the BEV communication controllers and vehicle-to-grid (V2G) technology. In this paper we use the Stackelberg game approach to achieve an efficient and effective optimized algorithm for the users (followers) based on time dependent pricing. We also assumed an electricity retailer company (leader) and a two-way bilateral communication procedure. The usage-based side of the game has been studied together with demand side management (DSM). Real-time pricing (RTP) from time-of-use (TOU) companies has been used for better results, and Monte Carlo simulation (MCS) handles the uncertain behavior of BEV drivers. Numerical results compared to those from the simulation show that with this method we can reshape the customer's demand for the best efficiency.",2019-02-13T17:44:00Z,2019-08-07T18:20:34Z,http://arxiv.org/abs/1902.05028v2,http://arxiv.org/pdf/1902.05028v2,eess.SP
Modeling the stylized facts of wholesale system marginal price (SMP) and   the impacts of regulatory reforms on the Greek Electricity Market,"G. Papaioannou, P. Papaioannou, N. Parliaris","This work presents the results of an empirical research with the target of modeling the stylized facts of the daily expost System Marginal Price (SMP) of the Greek wholesale electricity market, using data from January 2004 to December of 2011. SMP is considered here as the footprint of an underline stochastic and nonlinear process that bears all the information reflecting not only the effects of changes in endogenous or fundamental factors of the market but also the impacts of a series of regulatory reforms that have continuously changed the market's microstructure. To capture the dynamics of the conditional mean and volatility of SMP that generate the stylized facts(mean reversion, price spikes, fat tails price distribution etc), a number of ARMAX GARCH models have been estimated using as regressors an extensive set of fundamental factors in the Greek electricity market as well as dummy variables that mimic the history of Regulator's interventions. The findings show that changes in the microstructure of the market caused by the reforms have strongly affected the dynamic evolution of SMP and that the best found model captures adequately the stylized facts of the series that other electricity and financial markets share. The dynamics of the conditional volatility generated by the model can be extremely useful in the efforts that are under way towards market restructuring so the Greek market to be more compatible with the requirements of the European Target Model.",2014-01-20T20:40:22Z,2014-01-20T20:40:22Z,http://arxiv.org/abs/1401.5452v1,http://arxiv.org/pdf/1401.5452v1,q-fin.ST
Band power modulation through intracranial EEG stimulation and its   cross-session consistency,"Christoforos A Papasavvas, Gabrielle M Schroeder, Beate Diehl, Gerold Baier, Peter N Taylor, Yujiang Wang","Background: Direct electrical stimulation of the brain through intracranial electrodes is currently used to probe the epileptic brain as part of pre-surgical evaluation, and it is also being considered for therapeutic treatments through neuromodulation. It is still unknown, however, how consistent intracranial direct electrical stimulation responses are across sessions, to allow effective neuromodulation design.   Objective: To investigate the cross-session consistency of the electrophysiological effect of electrical stimulation delivered through intracranial EEG.   Methods: We analysed data from 79 epilepsy patients implanted with intracranial EEG who underwent brain stimulation as part of a memory experiment. We quantified the effect of stimulation in terms of band power modulation and compared this effect from session to session. As a reference, we applied the same measures during baseline periods.   Results: In most sessions, the effect of stimulation on band power could not be distinguished from baseline fluctuations of band power. Stimulation effect was also not consistent across sessions; only a third of the session pairs had a higher consistency than the baseline standards. Cross-session consistency is mainly associated with the strength of positive stimulation effects, and it also tends to be higher when the baseline conditions are more similar between sessions.   Conclusion: These findings can inform our practices for designing neuromodulation with greater efficacy when using direct electrical brain stimulation as a therapeutic treatment.",2020-05-28T19:51:04Z,2020-05-28T19:51:04Z,http://arxiv.org/abs/2005.14258v1,http://arxiv.org/pdf/2005.14258v1,q-bio.NC
Modelling uncertainty in coupled electricity and gas systems -- is it   worth the effort?,"Iegor Riepin, Thomas Möbius, Felix Müsgens","The interdependence of electricity and natural gas markets is becoming a major topic in energy research. Integrated energy models are used to assist decision-making for businesses and policymakers addressing challenges of energy transition and climate change. The analysis of complex energy systems requires large-scale models, which are based on extensive databases, intertemporal dynamics and a multitude of decision variables. Integrating such energy system models results in increased system complexity. This complexity poses a challenge for energy modellers to address multiple uncertainties that affect both markets. Stochastic optimisation approaches enable an adequate consideration of uncertainties in investment and operation planning; however, stochastic modelling of integrated large-scale energy systems further scales the level of complexity. In this paper, we combine integrated and stochastic optimisation problems and parametrise our model for European electricity and gas markets. We analyse and compare the impact of uncertain input parameters, such as gas and electricity demand, renewable energy capacities and fuel and CO2 prices, on the quality of the solution obtained in the integrated optimisation problem. Our results quantify the value of encoding uncertainty as a part of a model. While the methodological contribution should be of interest for energy modellers, our findings are relevant for industry experts and stakeholders with an empirical interest in the European energy system.",2020-08-17T11:08:09Z,2020-09-10T13:18:44Z,http://arxiv.org/abs/2008.07221v2,http://arxiv.org/pdf/2008.07221v2,q-fin.GN
ECG-Based Blood Pressure Estimation Using Mechano-Electric Coupling   Concept,"Seyedeh Somayyeh Mousavi, Mostafa Charmi, Mohammad Firouzmand, Mohammad Hemmati, Maryam Moghadam, Yadollah Ghorbani","The Electrocardiograph signal represents the heart's electrical activity while blood pressure results from the heart's mechanical activity. Previous studies have investigated how the heart's electrical and mechanical activities are related and have referred to their relationship as the Mechano-Electric Coupling term. A new method to estimate the blood pressure including is proposed which uses only the Electrocardiograph signal. In spite of studies performed on feature extraction based on the signals' physiological parameters (Parameter-based), in this work, the feature vectors are formed with samples of the Electrocardiograph signal in a particular time frame (Whole-based) and these vectors are input into Adaptive Boosting Regression to estimate blood pressure. The nonlinear relationship which correlates blood pressure with the Electrocardiograph signal is concluded by the results of this study. According to the results, the used algorithms, for estimating both diastolic blood pressures and mean arterial pressure, are in compliance with the standards of the Association for the Advancement of Medical Instrumentation. Also, according to the British Hypertension Society standard, estimating diastolic blood pressures and mean arterial pressure with the proposed method attain an A grade while it achieves B for systolic blood pressure. The results indicate that using the introduced method, blood pressure can be estimated continuously, noninvasively, without cuff, calibration-free and by using only the Electrocardiograph signal.",2020-08-23T19:34:15Z,2020-08-23T19:34:15Z,http://arxiv.org/abs/2008.10099v1,http://arxiv.org/pdf/2008.10099v1,eess.SP
The role of gap junctions and clustered connectivity in emergent   synchronisation patterns of inhibitory neuronal networks,"Hélène Todd, Alex Cayco-Gajic, Boris Gutkin","Inhibitory interneurons, ubiquitous in the central nervous system, form networks connected through both chemical synapses and gap junctions. These networks are essential for regulating the activity of principal neurons, especially by inducing temporally patterned dynamic states. We aim to understand the dynamic mechanisms for synchronisation in networks of electrically and chemically coupled interneurons. We use the exact mean-field reduction to derive a neural mass model for both homogeneous and clustered networks. We first analyse a single population of neurons to understand how the two couplings interact with one another. We demonstrate that the network transitions from an asynchronous to a synchronous regime either by increasing the strength of the gap junction connectivity or the strength of the background input current. Conversely, the strength of inhibitory synapses affects the population firing rate, suggesting that electrical and chemical coupling strengths act as complementary mechanisms by which networks can tune synchronous oscillatory behavior. In line with previous work, we confirm that the depolarizing spikelet is crucial for the emergence of synchrony. Furthermore, find that the fast frequency component of the spikelet ensures robustness to heterogeneity. Next, inspired by the existence of multiple interconnected interneuron subtypes in the cerebellum, we analyse networks consisting of two clusters of cell types defined by differing chemical versus electrical coupling strengths. We show that breaking the electrical and chemical coupling symmetry between these clusters induces bistability, so that a transient external input can switch the network between synchronous and asynchronous firing. Together, our results shows the variety of cell-intrinsic and network properties that contribute to synchronisation of interneuronal networks with multiple types of coupling.",2024-02-22T14:45:22Z,2024-02-22T14:45:22Z,http://arxiv.org/abs/2402.14592v1,http://arxiv.org/pdf/2402.14592v1,q-bio.NC
