title,authors,summary,published,updated,link,pdf_url,categories
Hierarchical structure of the countries based on electricity consumption   and economic growth,"Ersin Kantar, Alper Aslan, Bayram Deviren, Mustafa Keskin","We investigate the hierarchical structures of countries based on electricity consumption and economic growth by using the real amounts of their consumption over a certain time period. We use of electricity consumption data to detect the topological properties of 60 countries from 1971 to 2008. These countries are divided into three subgroups: low income group, middle income group and high income group countries. Firstly, a relationship between electricity consumption and economic growth is investigated by using the concept of hierarchical structure methods (minimal spanning tree (MST) and hierarchical tree (HT)). Secondly, we perform bootstrap techniques to investigate a value of the statistical reliability to the links of the MST. Finally, we use a clustering linkage procedure in order to observe the cluster structure more clearly. The results of the structural topologies of these trees are as follows: i) we identified different clusters of countries according to their geographical location and economic growth, ii) we found a strong relation between energy consumption and economic growth for all the income groups considered in this study and iii) the results are in good agreement with the causal relationship between electricity consumption and economic growth.",2014-06-25T13:18:18Z,2014-06-27T05:06:49Z,http://arxiv.org/abs/1406.6562v2,http://arxiv.org/pdf/1406.6562v2,q-fin.ST
Investigation of Electrical Conductivity Changes during Brain Functional   Activity in 3T MRI,"Kyu-Jin Jung, Chuanjiang Cui, Soo-Hyung Lee, Chan-Hee Park, Ji-Won Chun, Dong-Hyun Kim","Blood oxygenation level-dependent (BOLD) functional magnetic resonance imaging (fMRI) is widely used to visualize brain activation regions by detecting hemodynamic responses associated with increased metabolic demand. While alternative MRI methods have been employed to monitor functional activities, the investigation of in-vivo electrical property changes during brain function remains limited. In this study, we explored the relationship between fMRI signals and electrical conductivity (measured at the Larmor frequency) changes using phase-based electrical properties tomography (EPT). Our results revealed consistent patterns: conductivity changes showed negative correlations, with conductivity decreasing in the functionally active regions whereas B1 phase mapping exhibited positive correlations around activation regions. These observations were consistent across both motor and visual cortex activations. To further substantiate these findings, we conducted electromagnetic radio-frequency simulations that modeled activation states with varying conductivity, which demonstrated trends similar to our in-vivo results for both B1 phase and conductivity. These findings suggest that in-vivo electrical conductivity changes can indeed be measured during brain activity. However, further investigation is needed to fully understand the underlying mechanisms driving these measurements.",2024-09-12T07:34:44Z,2024-09-12T07:34:44Z,http://arxiv.org/abs/2409.07806v1,http://arxiv.org/pdf/2409.07806v1,q-bio.QM
Structural price model for electricity coupled markets,"Clemence Alasseur, Olivier Feron","We propose a new structural model that can compute the electricity spot and forward prices in two coupled markets with limited interconnection and multiple fuels. We choose a structural approach in order to represent some key characteristics of electricity spot prices such as their link to fuel prices, consumption level and production fleet. With this model, explicit formulas are also available for forward prices and other derivatives. We give some illustrative results of the behaviour of spot and forward prices, and of the values of transmission rights.",2017-04-20T06:56:43Z,2017-04-20T06:56:43Z,http://arxiv.org/abs/1704.06027v1,http://arxiv.org/pdf/1704.06027v1,q-fin.MF
Occipital and left temporal EEG correlates of phenomenal consciousness,Vitor Manuel Dinis Pereira,"In the first section, Introduction, we present our experimental design. In the second section, we characterize the grand average occipital and temporal electrical activity correlated with a contrast in access. In the third section, we characterize the grand average occipital and temporal electrical activity correlated with a contrast in phenomenology and conclude characterizing the grand average occipital and temporal electrical activity co-occurring with unconsciousness.",2017-11-05T00:43:09Z,2020-12-26T17:16:19Z,http://arxiv.org/abs/1712.02626v3,http://arxiv.org/pdf/1712.02626v3,q-bio.NC
Modeling and Simulation of Regenerative Braking Energy in DC Electric   Rail Systems,"M. Khodaparastan, A. Mohamed","Regenerative braking energy is the energy produced by a train during deceleration. When a train decelerates, the motors act as generators and produce electricity. This energy can be fed back to the third rail and consumed by other trains accelerating nearby. If there are no nearby trains, this energy is dumped as heat to avoid over voltage. Regenerative braking energy can be saved by installing energy storage systems (ESS) and reused later when it is needed. To find a suitable design, size and placement of energy storage, a good understanding of this energy is required. The aim of this paper is to model and simulate regenerative braking energy. The dc electric rail transit system model introduced in this paper includes trains, substations and rail systems.",2018-08-13T01:05:18Z,2018-08-13T01:05:18Z,http://arxiv.org/abs/1808.04032v1,http://arxiv.org/pdf/1808.04032v1,eess.SP
Price formation and optimal trading in intraday electricity markets with   a major player,"Olivier Féron, Peter Tankov, Laura Tinsi","We study price formation in intraday electricity markets in the presence of intermittent renewable generation. We consider the setting where a major producer may interact strategically with a large number of small producers. Using stochastic control theory we identify the optimal strategies of agents with market impact and exhibit the Nash equilibrium in closed form in the asymptotic framework of mean field games with a major player. This is a companion paper to [F\'eron, Tankov, and Tinsi, Price formation and optimal trading in intraday electricity markets, arXiv:2009.04786, 2020], where a similar model is developed in the setting of identical agents.",2020-11-15T23:10:50Z,2020-11-15T23:10:50Z,http://arxiv.org/abs/2011.07655v1,http://arxiv.org/pdf/2011.07655v1,"q-fin.PR, q-fin.TR"
Multi-Resolution Subspace-Based Optimization Method for the Retrieval of   2D Perfect Electric Conductors,"Xiuzhu Ye, Francesco Zardi, Marco Salucci, Andrea Massa","Perfect Electric Conductors (PECs) are imaged integrating the subspace-based optimizationmethod (SOM) within the iterative multi-scaling scheme (IMSA). Without a-priori information on the number or/and the locations of the scatterers and modelling their EM scattering interactions with a (known) probing source in terms of surface electric field integral equations, a segment-based representation of PECs is retrieved from the scattered field samples. The proposed IMSA-SOM inversion method is validated against both synthetic and experimental data by assessing the reconstruction accuracy, the robustness to the noise, and the computational efficiency with some comparisons, as well.",2022-08-23T13:10:02Z,2022-08-23T13:10:02Z,http://arxiv.org/abs/2208.10944v1,http://arxiv.org/pdf/2208.10944v1,eess.SP
The role of cellular coupling in the spontaneous generation of   electrical activity in uterine tissue,"Jinshan Xu, Shakti N. Menon, Rajeev Singh, Nicolas B. Garnier, Sitabhra Sinha, Alain Pumir","The spontaneous emergence of contraction-inducing electrical activity in the uterus at the beginning of labor remains poorly understood, partly due to the seemingly contradictory observation that isolated uterine cells are not spontaneously active. It is known, however, that the expression of gap junctions increases dramatically in the approach to parturition, which results in a significant increase in inter-cellular electrical coupling. In this paper, we build upon previous studies of the activity of electrically excitable smooth muscle cells (myocytes) and investigate the mechanism through which the coupling of these cells to electrically passive cells results in the generation of spontaneous activity in the uterus. Using a recently developed, realistic model of uterine muscle cell dynamics, we investigate a system consisting of a myocyte coupled to passive cells. We then extend our analysis to a simple two-dimensional lattice model of the tissue, with each myocyte being coupled to its neighbors, as well as to a random number of passive cells. We observe that different dynamical regimes can be observed over a range of gap junction conductances: at low coupling strength, the activity is confined to cell clusters, while the activity for high coupling may spread across the entire tissue. Additionally, we find that the system supports the spontaneous generation of spiral wave activity. Our results are both qualitatively and quantitatively consistent with observations from in vitro experiments. In particular, we demonstrate that an increase in inter-cellular electrical coupling, for realistic parameter values, strongly facilitates the appearance of spontaneous action potentials that may eventually lead to parturition.",2014-09-18T13:24:24Z,2014-09-18T13:24:24Z,http://arxiv.org/abs/1409.5302v1,http://arxiv.org/pdf/1409.5302v1,q-bio.TO
"Electrical Structure of Biological Cells and Tissues: impedance   spectroscopy, stereology, and singular perturbation theory",Robert Eisenberg,"Impedance Spectroscopy resolves electrical properties into uncorrelated variables, as a function of frequency, with exquisite resolution. Separation is robust and most useful when the system is linear. Impedance spectroscopy combined with appropriate structural knowledge provides insight into pathways for current flow, with more success than other methods. Biological applications of impedance spectroscopy are often not useful since so much of biology is strongly nonlinear in its essential features, and impedance spectroscopy is fundamentally a linear analysis. All cells and tissues have cell membranes and its capacitance is both linear and important to cell function. Measurements proved straightforward in skeletal muscle, cardiac muscle, and lens of the eye. In skeletal muscle, measurements provided the best estimates of the predominant (cell) membrane system that dominates electrical properties. In cardiac muscle, measurements showed definitively that classical microelectrode voltage clamp could not control the potential of the predominant membranes, that were in the tubular system separated from the extracellular space by substantial distributed resistance. In the lens of the eye, impedance spectroscopy changed the basis of all recording and interpretation of electrical measurements and laid the basis for Rae and Mathias extensive later experimental work. Many tissues are riddled with extracellular space as clefts and tubules, for example, cardiac muscle, the lens of the eye, most epithelia, and of course frog muscle. These tissues are best analyzed with a bidomain theory that arose from the work on electrical structure described here. There has been a great deal of work since then on the bi-domain and this represents the most important contribution to biology of the analysis of electrical structure in my view.",2015-11-04T14:15:18Z,2015-11-04T14:15:18Z,http://arxiv.org/abs/1511.01339v1,http://arxiv.org/pdf/1511.01339v1,q-bio.QM
Extending integrate-and-fire model neurons to account for the effects of   weak electric fields and input filtering mediated by the dendrite,"Florian Aspart, Josef Ladenbauer, Klaus Obermayer","How extracellular electric fields, as generated endogenously or through transcranial brain stimulation, affect the dynamics of large neuronal populations is of great interest but not well understood. To study the collective dynamics of large populations single-compartment (point) model neurons have been proven very successful. These models, however, lack the dendritic morphology to biophysically account for the effects of electric fields, and for changes in synaptic integration due to morphology alone. Here we (i) characterize the response of a canonical spatial (ball-and-stick) model neuron to fluctuating synaptic input as well as an oscillatory, weak electric field, and (ii) analytically derive an extension for popular integrate-and-fire point neuron models to accurately reproduce these responses. We obtain distinct filters mediated by the dendrite for inputs at the soma (high-pass filter) or at the distal dendritic site (low-pass filter), and find that the electric field induces spike rate resonance in the beta and gamma frequency bands or even higher frequencies, depending on the location of synaptic background input. Due to their computational efficiency the extended point models are well suited for application in large populations of coupled neurons with different morphology, exposed to extracellular electric fields.",2016-03-15T20:44:36Z,2016-11-09T14:14:24Z,http://arxiv.org/abs/1603.04881v4,http://arxiv.org/pdf/1603.04881v4,q-bio.NC
Electricity Consumption Forecasting for Smart Grid using the   Multi-Factor Back-Propagation Neural Network,"Hao Song, Yu Chen, Ning Zhou, Genshe Chen","With the development of modern information technology (IT), a smart grid has become one of the major components of smart cities. To take full advantage of the smart grid, the capability of intelligent scheduling and planning of electricity delivery is essential. In practice, many factors have an impact on electricity consumption, which necessitates information fusion technologies for a thorough understanding. For this purpose, researchers have investigated methodologies for collecting electricity consumption related information and variant multi-factor power consumption forecasting models. In addition, conducting a comprehensive analysis and obtaining an accurate evaluation of power consumption are the premise and basis for a more robust and efficient power grid design and transformation. Therefore, it is meaningful to explore forecasting models that are able to reflect the power consumption changes and internal relations within fusional information effectively. Making electricity consumption forecasting based on the neural network has been a popular research topic in recent years, and the back-propagation neural network (BPNN) algorithm has been recognized as a mature and effective method. In this paper, BPNN is adopted to forecast the electricity consumption using Pecan Street, a community with a relatively large-scale smart grid, as a case study, and takes multiple factors into account, such as weather condition, weekend and holidays. The influences of each factor have been evaluated for a deeper insight. We hope this work will inspire more discussion and further study to guide the design of future smart grids.",2019-02-27T23:10:08Z,2019-02-27T23:10:08Z,http://arxiv.org/abs/1902.10823v1,http://arxiv.org/pdf/1902.10823v1,eess.SP
A Comparison of Various Electricity Tariff Price Forecasting Techniques   in Turkey and Identifying the Impact of Time Series Periods,T. O. Benli,"It is very vital for suppliers and distributors to predict the deregulated electricity prices for creating their bidding strategies in the competitive market area. Pre requirement of succeeding in this field, accurate and suitable electricity tariff price forecasting tools are needed. In the presence of effective forecasting tools, taking the decisions of production, merchandising, maintenance and investment with the aim of maximizing the profits and benefits can be successively and effectively done. According to the electricity demand, there are four various electricity tariffs pricing in Turkey; monochromic, day, peak and night. The objective is find the best suitable tool for predicting the four pricing periods of electricity and produce short term forecasts (one year ahead-monthly). Our approach based on finding the best model, which ensures the smallest forecasting error measurements of: MAPE, MAD and MSD. We conduct a comparison of various forecasting approaches in total accounts for nine teen, at least all of those have different aspects of methodology. Our beginning step was doing forecasts for the year 2015. We validated and analyzed the performance of our best model and made comparisons to see how well the historical values of 2015 and forecasted data for that specific period matched. Results show that given the time-series data, the recommended models provided good forecasts. Second part of practice, we also include the year 2015, and compute all the models with the time series of January 2011 to December 2015. Again by choosing the best appropriate forecasting model, we conducted the forecast process and also analyze the impact of enhancing of time series periods (January 2007 to December 2015) to model that we used for forecasting process.",2016-08-18T07:16:08Z,2016-08-18T07:16:08Z,http://arxiv.org/abs/1610.08415v1,http://arxiv.org/pdf/1610.08415v1,q-fin.ST
Using electrical impedance spectroscopy to identify equivalent circuit   models of lubricated contacts with complex geometry: in-situ application to   mini traction machine,"Min Yu, Jie Zhang, Arndt Joedicke, Tom Reddyhoff","Electrical contact resistance or capacitance as measured between a lubricated contact has been used in tribometers, partially reflecting the lubrication condition. In contrast, the electrical impedance provides rich information of magnitude and phase, which can be interpreted using equivalent circuit models, enabling more comprehensive measurements, including the variation of lubricant film thickness and the asperity (metal to metal) contact area. An accurate circuit model of the lubricated contact is critical as needed for the electrical impedance analysis. However, existing circuit models are hand derived and suited to interfaces with simple geometry, such as parallel plates, concentric and eccentric cylinders. Circuit model identification of lubricated contacts with complex geometry is challenging. This work takes the ball-on-disc lubricated contact in a Mini Traction Machine (MTM) as an example, where screws on the ball, grooves on the disc, and contact close to the disc edge make the overall interface geometry complicated. The electrical impedance spectroscopy (EIS) is used to capture its frequency response, with a group of load, speed, and temperature varied and tested separately. The results enable an identification of equivalent circuit models by fitting parallel resistor-capacitor models, the dependence on the oil film thickness is further calibrated using a high-accuracy optical interferometry, which is operated under the same lubrication condition as in the MTM. Overall, the proposed method is applicable to general lubricated interfaces for the identification of equivalent circuit models, which in turn facilitates in-situ tribo-contacts with electric impedance measurement of oil film thickness. It does not need transparent materials as optical techniques do, or structural modifications for piezoelectric sensor mounting as ultrasound techniques do.",2023-07-07T15:39:12Z,2023-07-07T15:39:12Z,http://arxiv.org/abs/2307.03668v1,http://arxiv.org/pdf/2307.03668v1,eess.SP
Investigation of temperature stress tolerance in Arabidopsis STTM165/166   using electrophysiology and RNA-Seq,"Dongjie Zhao, Qinghui Chen, Ziyang Wang, Lucy Arbanas, Guiliang Tang","Plant electrical signals have been shown to be generated in response to various environmental stresses, but the relationship between these signals and stress tolerance is not well understood. In this study, we used the Arabidopsis STTM165/166 mutant, which exhibits enhanced temperature tolerance, to examine this relationship. Surface recording techniques were utilized to compare the generation ratio and duration characteristics of electrical signals in the STTM165/166 mutant and wild type (WT). Patch-clamp recording was employed to assess ion channel currents, specifically those of calcium ions. The current intensity of the mutant was found to be lower than that of the WT. As calcium ions are involved in the generation of plant electrical signals, we hypothesized that the reduced calcium channel activity in the mutant increased its electrical signal threshold. RNA-Seq analysis revealed differential expression of AHA genes in the STTM165/166 mutant, which may contribute to the prolonged depolarization phenotype. Gene Ontology enrichment of differentially expressed genes (DEGs) identified associations between these DEGs and various stresses, including temperature, salt, and those related to the jasmonic acid and abscisic acid pathways. These findings provide experimental evidence for the use of plant electrical signals in characterizing stress tolerance and explore potential ion mechanisms through patch-clamp recording and DEG Gene Ontology analysis. They also emphasize the need for further research on the relationship between plant electrical signals and stress tolerance.",2023-09-08T03:58:27Z,2023-09-08T03:58:27Z,http://arxiv.org/abs/2309.04107v1,http://arxiv.org/pdf/2309.04107v1,q-bio.MN
A Bio-Polymer Transistor: Electrical Amplification by Microtubules,"Avner Priel, Arnolt J. Ramos, Jack A. Tuszynski, Horacio F. Cantiello","Microtubules (MTs) are important cytoskeletal structures, engaged in a number of specific cellular activities, including vesicular traffic, cell cyto-architecture and motility, cell division, and information processing within neuronal processes. MTs have also been implicated in higher neuronal functions, including memory, and the emergence of ""consciousness"". How MTs handle and process electrical information, however, is heretofore unknown. Here we show new electrodynamic properties of MTs. Isolated, taxol-stabilized microtubules behave as bio-molecular transistors capable of amplifying electrical information. Electrical amplification by MTs can lead to the enhancement of dynamic information, and processivity in neurons can be conceptualized as an ""ionic-based"" transistor, which may impact among other known functions, neuronal computational capabilities.",2006-06-09T07:34:49Z,2006-06-09T07:34:49Z,http://arxiv.org/abs/q-bio/0606009v1,http://arxiv.org/pdf/q-bio/0606009v1,"q-bio.SC, q-bio.BM"
Distinguishing cancerous from non-cancerous cells through analysis of   electrical noise,"D. C. Lovelady, T. C. Richmond, A. N. Maggi, C. -M. Lo, D. A. Rabson","Since 1984, electric cell-substrate impedance sensing (ECIS) has been used to monitor cell behavior in tissue culture and has proven sensitive to cell morphological changes and cell motility. We have taken ECIS measurements on several cultures of non-cancerous (HOSE) and cancerous (SKOV) human ovarian surface epithelial cells. By analyzing the noise in real and imaginary electrical impedance, we demonstrate that it is possible to distinguish the two cell types purely from signatures of their electrical noise. Our measures include power-spectral exponents, Hurst and detrended fluctuation analysis, and estimates of correlation time; principal-component analysis combines all the measures. The noise from both cancerous and non-cancerous cultures shows correlations on many time scales, but these correlations are stronger for the non-cancerous cells.",2007-07-28T15:32:19Z,2007-07-28T15:32:19Z,http://arxiv.org/abs/0707.4244v1,http://arxiv.org/pdf/0707.4244v1,"q-bio.CB, q-bio.QM"
Impact of the Overall Electrical Filter Shaping in Next-Generation 25G   and 50G PON,"Pablo Torres-Ferrera, Valter Ferrero, Maurizio Valvo, Roberto Gaudino","Next-generation high-speed passive optical network (HS-PON) transceivers supporting 25, 50 and 100 Gb/s are under the early stage of their standardization process. One key aspect of this process is the choice of the best modulation format. To this end, performance comparisons among several modulation formats against different physical constraints have been presented in literature and are still being carried out. In our contribution, we performed an exhaustive analysis on the impact of transceivers electrical frequency response shape on the performance of 2-levels pulse amplitude modulation (PAM-2), 4-levels PAM (PAM-4), electrical and optical duobinary modulation formats with adaptive equalizer at the receiver side. We show by means of numerical simulations that the specification of the typically used -3dB bandwidth is not sufficient, since also out-of-band electrical frequency response specifications (such as the -20dB bandwidth) has a huge impact on the performance of the analyzed modulation formats. The normalized graphs given at the end of the paper in terms of -3dB and -20 dB bandwidths can thus be useful for the design of the next generation of HS-PON transceivers.",2018-01-25T20:09:37Z,2018-01-25T20:09:37Z,http://arxiv.org/abs/1801.08584v1,http://arxiv.org/pdf/1801.08584v1,eess.SP
